{
  "schema_version": 1,
  "data_kind": "synthetic",
  "description": "Artificial coordinates for arithmetic and CLI tests; no infant/patient image or annotation is used.",
  "coordinate_units": "px",
  "angle_units": "deg",
  "coordinate_order": [
    "x1",
    "y1",
    "x2",
    "y2",
    "x3",
    "y3",
    "x4",
    "y4",
    "x5",
    "y5"
  ],
  "nominal_level": 0.9,
  "images": [
    {
      "id": "synthetic-000",
      "partition": "calibration",
      "raters_px": [
        [
          [
            -0.1,
            0.2
          ],
          [
            79.9,
            0.2
          ],
          [
            62.07765217,
            34.54919458
          ],
          [
            34.9,
            5.2
          ],
          [
            59.10880936,
            -12.51817003
          ]
        ],
        [
          [
            -0.05,
            0.1
          ],
          [
            79.95,
            0.1
          ],
          [
            61.40247461,
            35.10444279
          ],
          [
            34.95,
            5.1
          ],
          [
            58.55805066,
            -13.41107625
          ]
        ],
        [
          [
            0.0,
            0.0
          ],
          [
            80.0,
            0.0
          ],
          [
            60.71150439,
            35.64177772
          ],
          [
            35.0,
            5.0
          ],
          [
            57.98133329,
            -14.28362829
          ]
        ],
        [
          [
            0.05,
            -0.1
          ],
          [
            80.05,
            -0.1
          ],
          [
            60.00518387,
            36.1608189
          ],
          [
            35.05,
            4.9
          ],
          [
            57.37934639,
            -15.13497666
          ]
        ],
        [
          [
            0.1,
            -0.2
          ],
          [
            80.1,
            -0.2
          ],
          [
            59.28396459,
            36.66119672
          ],
          [
            35.1,
            4.8
          ],
          [
            56.75280684,
            -15.96429522
          ]
        ]
      ],
      "pass_means_px": [
        [
          -0.6,
          -0.15,
          79.34,
          -0.18,
          60.29150439,
          35.91177772,
          34.46,
          4.88,
          57.23133329,
          -14.22362829
        ],
        [
          -0.2,
          -0.05,
          79.78,
          -0.06,
          60.57150439,
          35.73177772,
          34.82,
          4.96,
          57.73133329,
          -14.26362829
        ],
        [
          0.2,
          0.05,
          80.22,
          0.06,
          60.85150439,
          35.55177772,
          35.18,
          5.04,
          58.23133329,
          -14.30362829
        ],
        [
          0.6,
          0.15,
          80.66,
          0.18,
          61.13150439,
          35.37177772,
          35.54,
          5.12,
          58.73133329,
          -14.34362829
        ]
      ],
      "pass_variances_px2": [
        [
          0.776,
          0.88377778,
          0.99155556,
          1.09933333,
          1.20711111,
          1.31488889,
          1.42266667,
          1.53044444,
          1.63822222,
          1.746
        ],
        [
          0.792,
          0.902,
          1.012,
          1.122,
          1.232,
          1.342,
          1.452,
          1.562,
          1.672,
          1.782
        ],
        [
          0.808,
          0.92022222,
          1.03244444,
          1.14466667,
          1.25688889,
          1.36911111,
          1.48133333,
          1.59355556,
          1.70577778,
          1.818
        ],
        [
          0.824,
          0.93844444,
          1.05288889,
          1.16733333,
          1.28177778,
          1.39622222,
          1.51066667,
          1.62511111,
          1.73955556,
          1.854
        ]
      ],
      "raw_angle_intervals_deg": [
        [
          48.0,
          37.0
        ],
        [
          52.0,
          43.0
        ]
      ]
    },
    {
      "id": "synthetic-001",
      "partition": "calibration",
      "raters_px": [
        [
          [
            0.3,
            0.4
          ],
          [
            80.3,
            0.4
          ],
          [
            62.3081631,
            34.90523896
          ],
          [
            35.3,
            5.4
          ],
          [
            59.41881994,
            -12.44047435
          ]
        ],
        [
          [
            0.5,
            0.0
          ],
          [
            80.5,
            0.0
          ],
          [
            59.47771113,
            37.01670453
          ],
          [
            35.5,
            5.0
          ],
          [
            57.04014481,
            -15.88114368
          ]
        ]
      ],
      "pass_means_px": [
        [
          -0.2,
          0.05,
          79.74,
          0.02,
          60.50384586,
          36.26826768,
          34.86,
          5.08,
          57.53004989,
          -14.14369339
        ],
        [
          0.2,
          0.15,
          80.18,
          0.14,
          60.78384586,
          36.08826768,
          35.22,
          5.16,
          58.03004989,
          -14.18369339
        ],
        [
          0.6,
          0.25,
          80.62,
          0.26,
          61.06384586,
          35.90826768,
          35.58,
          5.24,
          58.53004989,
          -14.22369339
        ],
        [
          1.0,
          0.35,
          81.06,
          0.38,
          61.34384586,
          35.72826768,
          35.94,
          5.32,
          59.03004989,
          -14.26369339
        ]
      ],
      "pass_variances_px2": [
        [
          0.776,
          0.88377778,
          0.99155556,
          1.09933333,
          1.20711111,
          1.31488889,
          1.42266667,
          1.53044444,
          1.63822222,
          1.746
        ],
        [
          0.792,
          0.902,
          1.012,
          1.122,
          1.232,
          1.342,
          1.452,
          1.562,
          1.672,
          1.782
        ],
        [
          0.808,
          0.92022222,
          1.03244444,
          1.14466667,
          1.25688889,
          1.36911111,
          1.48133333,
          1.59355556,
          1.70577778,
          1.818
        ],
        [
          0.824,
          0.93844444,
          1.05288889,
          1.16733333,
          1.28177778,
          1.39622222,
          1.51066667,
          1.62511111,
          1.73955556,
          1.854
        ]
      ],
      "raw_angle_intervals_deg": [
        [
          48.35,
          37.3
        ],
        [
          52.35,
          43.3
        ]
      ]
    },
    {
      "id": "synthetic-002",
      "partition": "calibration",
      "raters_px": [
        [
          [
            0.7,
            0.6
          ],
          [
            80.7,
            0.6
          ],
          [
            62.5377781,
            35.26030456
          ],
          [
            35.7,
            5.6
          ],
          [
            59.72821263,
            -12.36232162
          ]
        ],
        [
          [
            0.9,
            0.2
          ],
          [
            80.9,
            0.2
          ],
          [
            59.67045776,
            37.37087717
          ],
          [
            35.9,
            5.2
          ],
          [
            57.32685223,
            -15.79738088
          ]
        ]
      ],
      "pass_means_px": [
        [
          0.2,
          0.25,
          80.14,
          0.22,
          60.71523491,
          36.62360839,
          35.26,
          5.28,
          57.82813922,
          -14.06322652
        ],
        [
          0.6,
          0.35,
          80.58,
          0.34,
          60.99523491,
          36.44360839,
          35.62,
          5.36,
          58.32813922,
          -14.10322652
        ],
        [
          1.0,
          0.45,
          81.02,
          0.46,
          61.27523491,
          36.26360839,
          35.98,
          5.44,
          58.82813922,
          -14.14322652
        ],
        [
          1.4,
          0.55,
          81.46,
          0.58,
          61.55523491,
          36.08360839,
          36.34,
          5.52,
          59.32813922,
          -14.18322652
        ]
      ],
      "pass_variances_px2": [
        [
          0.776,
          0.88377778,
          0.99155556,
          1.09933333,
          1.20711111,
          1.31488889,
          1.42266667,
          1.53044444,
          1.63822222,
          1.746
        ],
        [
          0.792,
          0.902,
          1.012,
          1.122,
          1.232,
          1.342,
          1.452,
          1.562,
          1.672,
          1.782
        ],
        [
          0.808,
          0.92022222,
          1.03244444,
          1.14466667,
          1.25688889,
          1.36911111,
          1.48133333,
          1.59355556,
          1.70577778,
          1.818
        ],
        [
          0.824,
          0.93844444,
          1.05288889,
          1.16733333,
          1.28177778,
          1.39622222,
          1.51066667,
          1.62511111,
          1.73955556,
          1.854
        ]
      ],
      "raw_angle_intervals_deg": [
        [
          48.7,
          37.6
        ],
        [
          52.7,
          43.6
        ]
      ]
    },
    {
      "id": "synthetic-003",
      "partition": "calibration",
      "raters_px": [
        [
          [
            1.1,
            0.8
          ],
          [
            81.1,
            0.8
          ],
          [
            62.76650281,
            35.61438626
          ],
          [
            36.1,
            5.8
          ],